{
  "schema_version": "1.0.0",
  "postgres_minimum_major": 16,
  "logical_schemas": [
    "iam",
    "gateway",
    "catalog",
    "telemetry",
    "security",
    "ops"
  ],
  "required_tables": [
    "catalog.active_artifact_pointer",
    "catalog.archetype_bundle_binding",
    "catalog.archetype_capacity_policy",
    "catalog.artifact_dependency",
    "catalog.artifact_rollout_evidence",
    "catalog.bundle_runtime_incident",
    "catalog.capture_run",
    "catalog.compiled_rule_index",
    "catalog.environment_archetype",
    "catalog.environment_archetype_version",
    "catalog.evidence_item",
    "catalog.evidence_set",
    "catalog.model_alias",
    "catalog.model_capability",
    "catalog.model_definition",
    "catalog.model_discovery_observation",
    "catalog.model_discovery_run",
    "catalog.price_entry",
    "catalog.price_version",
    "catalog.replay_verification",
    "catalog.transport_bundle",
    "catalog.versioned_artifact",
    "gateway.anthropic_credential",
    "gateway.auto_reauth_strategy",
    "gateway.credential_active_scheduling_config",
    "gateway.credential_auth_secret_stage",
    "gateway.credential_auth_version",
    "gateway.credential_egress_binding",
    "gateway.credential_enrollment",
    "gateway.credential_group",
    "gateway.credential_group_migration",
    "gateway.credential_identity",
    "gateway.credential_lifecycle_event",
    "gateway.credential_profile",
    "gateway.credential_profile_change",
    "gateway.credential_provider_profile",
    "gateway.credential_scheduling_config",
    "gateway.credential_transport_blocker",
    "gateway.device_identity",
    "gateway.egress_observation",
    "gateway.group_accepted_client_class",
    "gateway.group_active_config",
    "gateway.group_config",
    "gateway.group_model_allowlist",
    "gateway.maintenance_operation",
    "gateway.managed_browser_material_version",
    "gateway.managed_browser_secret_stage",
    "gateway.openai_account",
    "gateway.openai_group_policy",
    "gateway.openai_oauth_session",
    "gateway.openai_response_binding",
    "gateway.openai_settings",
    "gateway.proxy_endpoint",
    "gateway.proxy_probe_observation",
    "iam.api_idempotency_record",
    "iam.management_session",
    "iam.management_step_up_grant",
    "iam.mfa_enrollment",
    "iam.password_credential",
    "iam.platform_key",
    "iam.platform_key_active_config",
    "iam.platform_key_config",
    "iam.platform_key_ip_allowlist",
    "iam.platform_key_model_allowlist",
    "iam.platform_key_secret_reveal",
    "iam.user_account",
    "ops.alert",
    "ops.alert_silence",
    "ops.backup_run",
    "ops.durable_job",
    "ops.durable_job_history",
    "ops.event_consumer_checkpoint",
    "ops.export_job",
    "ops.integrity_check_run",
    "ops.notification_delivery",
    "ops.notification_destination",
    "ops.notification_inbox",
    "ops.outbox_history",
    "ops.outbox_message",
    "ops.price_sync_state",
    "ops.release_gate_run",
    "ops.release_manifest",
    "ops.restore_drill",
    "ops.retention_policy",
    "ops.schema_migration",
    "ops.system_setting",
    "ops.upgrade_run",
    "security.approval_case",
    "security.approval_grant",
    "security.audit_chain_head",
    "security.audit_daily_seal",
    "security.audit_event",
    "security.business_key_material",
    "security.deletion_ledger",
    "security.encrypted_secret",
    "security.platform_key_auth_event",
    "telemetry.attempt_record",
    "telemetry.attempt_submission_intent",
    "telemetry.connection_attempt_record",
    "telemetry.cost_estimate",
    "telemetry.credential_cooldown_event",
    "telemetry.credential_quota_current",
    "telemetry.credential_quota_observation",
    "telemetry.endpoint_access_event",
    "telemetry.request_body",
    "telemetry.request_decision_event",
    "telemetry.request_record",
    "telemetry.request_resource_event",
    "telemetry.request_stage_timing",
    "telemetry.response_delivery_record",
    "telemetry.subscription_plan_current",
    "telemetry.subscription_plan_observation",
    "telemetry.token_estimate",
    "telemetry.transport_event",
    "telemetry.usage_aggregate_contribution",
    "telemetry.usage_daily",
    "telemetry.usage_hourly",
    "telemetry.usage_observation"
  ],
  "database_roles": [
    "gateway_migrator",
    "gateway_runtime",
    "gateway_readonly",
    "gateway_backup"
  ],
  "uuid_generation": "application_uuid_v7",
  "enum_storage": "text_check_fail_closed"
}
